{
  "$schema": "http://json-schema.org/draft-07/schema#",
  "title": "Automa Workflow Configuration",
  "description": "JSON Schema specification for Automa workflow and package automation files (*.workflow.json, *.package.json)",
  "type": "object",
  "required": ["name"],
  "properties": {
    "id": {
      "type": "string",
      "description": "Unique identifier of the workflow or package"
    },
    "name": {
      "type": "string",
      "description": "Display name of the workflow"
    },
    "description": {
      "type": "string",
      "description": "Detailed description or markdown documentation of the workflow"
    },
    "icon": {
      "type": "string",
      "description": "Icon identifier (e.g. riGlobalLine, riTerminalBoxLine, riFileTextLine)"
    },
    "version": {
      "type": "string",
      "description": "Version of the workflow or package (semver formatted, e.g. 1.0.0)"
    },
    "extVersion": {
      "type": "string",
      "description": "Automa Extension / Core engine compatibility version"
    },
    "drawflow": {
      "type": "object",
      "description": "Visual canvas data containing graph nodes, block configurations, and connecting edges",
      "properties": {
        "nodes": {
          "type": "array",
          "description": "List of executable blocks in the workflow graph",
          "items": {
            "$ref": "#/definitions/WorkflowNode"
          }
        },
        "edges": {
          "type": "array",
          "description": "Connections routing execution flow between blocks",
          "items": {
            "$ref": "#/definitions/WorkflowEdge"
          }
        },
        "zoom": {
          "type": "number",
          "description": "Canvas zoom level"
        }
      }
    },
    "nodes": {
      "type": "array",
      "description": "Top-level nodes array (alternative format)",
      "items": {
        "$ref": "#/definitions/WorkflowNode"
      }
    },
    "edges": {
      "type": "array",
      "description": "Top-level edges array (alternative format)",
      "items": {
        "$ref": "#/definitions/WorkflowEdge"
      }
    },
    "table": {
      "type": "array",
      "description": "Table column definitions for workflow scraped/processed data",
      "items": {
        "type": "object",
        "required": ["id", "name"],
        "properties": {
          "id": { "type": "string" },
          "name": { "type": "string" },
          "type": { "type": "string", "enum": ["string", "number", "boolean", "json", "any"] }
        }
      }
    },
    "variables": {
      "description": "Default local variables available during workflow execution",
      "oneOf": [
        {
          "type": "object",
          "additionalProperties": true
        },
        {
          "type": "array",
          "items": {
            "type": "object",
            "required": ["name", "value"],
            "properties": {
              "name": { "type": "string" },
              "value": {},
              "type": { "type": "string", "enum": ["string", "number", "boolean", "json", "secret"] }
            }
          }
        }
      ]
    },
    "settings": {
      "type": "object",
      "description": "Workflow execution behavior settings",
      "properties": {
        "debugMode": { "type": "boolean", "description": "Enable step-by-step debug logging and live breakpoints" },
        "blockDelay": { "type": "number", "description": "Delay in milliseconds between executing consecutive blocks" },
        "saveLog": { "type": "boolean", "description": "Automatically save execution logs upon completion" },
        "restartTimes": { "type": "integer", "description": "Number of retry attempts if execution encounters an error" },
        "notification": { "type": "boolean", "description": "Show system notification when workflow finishes" },
        "execContext": { "type": "string", "enum": ["popup", "background", "tab", "offscreen"], "description": "Browser context in which the workflow executes" },
        "onError": { "type": "string", "enum": ["stop-workflow", "continue-workflow", "restart-workflow"], "description": "Action to take when an unhandled error occurs in a block" },
        "reuseLastState": { "type": "boolean", "description": "Persist and reuse browser state across runs" }
      }
    },
    "globalData": {
      "type": "string",
      "description": "Global JSON data string accessible via {{globalData.key}}"
    }
  },
  "definitions": {
    "WorkflowNode": {
      "type": "object",
      "required": ["id", "label"],
      "properties": {
        "id": {
          "type": "string",
          "description": "Unique NanoID string identifying this block in the graph"
        },
        "label": {
          "type": "string",
          "description": "Block type identifier",
          "enum": [
            "trigger",
            "new-tab",
            "active-tab",
            "open-url",
            "close-tab",
            "click-element",
            "get-text",
            "forms",
            "javascript-code",
            "conditions",
            "loop-data",
            "loop-elements",
            "loop-breakpoint",
            "delay",
            "export-data",
            "insert-data",
            "log-data",
            "http-request",
            "take-screenshot",
            "element-exists",
            "switch-to",
            "upload-file",
            "press-key",
            "scroll-page",
            "handle-download",
            "tab-url",
            "blocks-group",
            "package",
            "webhook",
            "event-listener",
            "note"
          ]
        },
        "type": {
          "type": "string",
          "description": "VueFlow Component renderer type (defaults to BlockBasic)",
          "default": "BlockBasic"
        },
        "position": {
          "type": "object",
          "properties": {
            "x": { "type": "number" },
            "y": { "type": "number" }
          },
          "required": ["x", "y"]
        },
        "data": {
          "type": "object",
          "description": "Block-specific configuration parameters and variables",
          "properties": {
            "description": { "type": "string", "description": "User note or label for this specific block" },
            "disableBlock": { "type": "boolean", "description": "Temporarily skip executing this block" },
            "url": { "type": "string", "description": "URL to navigate to or request" },
            "selector": { "type": "string", "description": "CSS selector or XPath targeting DOM elements" },
            "code": { "type": "string", "description": "Custom JavaScript code for javascript-code blocks" },
            "delay": { "type": "number", "description": "Delay duration in milliseconds or seconds" },
            "variableName": { "type": "string", "description": "Variable name to store output data" },
            "conditions": { "type": "array", "description": "Conditional rule assertions for branching logic" },
            "loopId": { "type": "string", "description": "Identifier for the enclosing loop container" },
            "parameters": { "type": "array", "description": "Input parameters declared in trigger block" }
          }
        }
      }
    },
    "WorkflowEdge": {
      "type": "object",
      "required": ["id", "source", "target"],
      "properties": {
        "id": { "type": "string", "description": "Unique Edge ID" },
        "source": { "type": "string", "description": "Originating block ID" },
        "target": { "type": "string", "description": "Destination block ID" },
        "sourceHandle": { "type": "string", "description": "Output port name (e.g. source__fallback, source__true, source__false)" },
        "targetHandle": { "type": "string", "description": "Input port name" }
      }
    }
  }
}
