{
  "name": "E2E Verification Workflow",
  "nodes": [
    {
      "id": "block-trigger",
      "label": "trigger",
      "type": "trigger",
      "data": {}
    },
    {
      "id": "block-conditions",
      "label": "conditions",
      "type": "conditions",
      "data": {
        "conditions": [
          {
            "type": "==",
            "compareValue": "hello",
            "value": "hello",
            "id": "cond-1"
          }
        ]
      }
    },
    {
      "id": "block-insert-data",
      "label": "insert-data",
      "type": "insert-data",
      "data": {
        "dataList": [
          {
            "type": "table",
            "name": "users",
            "value": "Alice",
            "isFile": false
          },
          {
            "type": "variable",
            "name": "testVar",
            "value": "insertedValue",
            "isFile": false
          }
        ]
      }
    },
    {
      "id": "block-loop-data",
      "label": "loop-data",
      "type": "loop-data",
      "data": {
        "loopId": "loop-1",
        "loopThrough": "custom-data",
        "loopData": "[100, 200, 300]"
      }
    },
    {
      "id": "block-loop-breakpoint",
      "label": "loop-breakpoint",
      "type": "loop-breakpoint",
      "data": {
        "loopId": "loop-1"
      }
    }
  ],
  "edges": [
    {
      "id": "edge-1",
      "source": "block-trigger",
      "target": "block-conditions",
      "sourceHandle": "block-trigger-output-1",
      "targetHandle": "block-conditions-input-1"
    },
    {
      "id": "edge-2",
      "source": "block-conditions",
      "target": "block-insert-data",
      "sourceHandle": "block-conditions-cond-1",
      "targetHandle": "block-insert-data-input-1"
    },
    {
      "id": "edge-3",
      "source": "block-insert-data",
      "target": "block-loop-data",
      "sourceHandle": "block-insert-data-output-1",
      "targetHandle": "block-loop-data-input-1"
    },
    {
      "id": "edge-4",
      "source": "block-loop-data",
      "target": "block-loop-breakpoint",
      "sourceHandle": "block-loop-data-output-1",
      "targetHandle": "block-loop-breakpoint-input-1"
    }
  ],
  "table": [
    {
      "id": "col-users",
      "name": "users",
      "type": "any"
    }
  ]
}
